a lion lying down	[{'url': 'https://plus.unsplash.com/premium_photo-1669725687221-6fe12c2da6b1?q=80&w=3189&auto=format&fit=crop&ixlib=rb-4.0.3&ixid=M3wxMjA3fDB8MHxwaG90by1wYWdlfHx8fGVufDB8fHx8fA%3D%3D', 'path': 'full/d7850172c77a0df5544dd4aaf4d7eba963689bfb.jpg', 'checksum': 'be54b92d0378fd69baebe3bfeaacf1e4', 'status': 'downloaded'}]	Wild Lion	2022-11-29 15:20:08
monkey holding banana peel during daytime	[{'url': 'https://images.unsplash.com/photo-1501286353178-1ec881214838?q=80&w=5146&auto=format&fit=crop&ixlib=rb-4.0.3&ixid=M3wxMjA3fDB8MHxwaG90by1wYWdlfHx8fGVufDB8fHx8fA%3D%3D', 'path': 'full/9e61c2649c1a59737e54d1c3f7356dbc3317b387.jpg', 'checksum': 'b7b3767cfcb93c5620eb57a21dd5365d', 'status': 'downloaded'}]	I cant help but roll minion voices through my mind as I look at this photo	2017-07-29 00:00:40
brown deer on brown land near trees	[{'url': 'https://images.unsplash.com/photo-1485833077593-4278bba3f11f?q=80&w=5472&auto=format&fit=crop&ixlib=rb-4.0.3&ixid=M3wxMjA3fDB8MHxwaG90by1wYWdlfHx8fGVufDB8fHx8fA%3D%3D', 'path': 'full/eb66b0d556ad49ec3cb6cd1d4087c076e7909fb6.jpg', 'checksum': '75a8483e52d58dd14e2963078ce81ef5', 'status': 'downloaded'}]	"Deer in the middle of a road in Québec.

Jp Valery is one of the best photographers in Montréal, QC. He’s a self-taught photographer passionate by his craft. He’s available for hire - no projects are too big or too small - and can be contacted at contact@jpvalery.photo. 

His pictures have received almost 20M views on Unsplash where he has been nominated Community Allstar for 2 years in a row.

Don’t hesitate to contact Jp Valery if you’re looking for a talented photographer in Montreal, Quebec with great photography services."	2017-01-31 03:28:46
two brown deers in woods	[{'url': 'https://images.unsplash.com/photo-1439886183900-e79ec0057170?q=80&w=2000&auto=format&fit=crop&ixlib=rb-4.0.3&ixid=M3wxMjA3fDB8MHxwaG90by1wYWdlfHx8fGVufDB8fHx8fA%3D%3D', 'path': 'full/2590ce72ae3170e99f68ab51d2b68f6a50eca9e8.jpg', 'checksum': 'bdfef1fa8d782886c637f10ed7385ac7', 'status': 'downloaded'}]	Download this free HD photo of animal, nature, wildlife, and deer by Andreas (@imwlf)	2015-08-18 08:24:00
two penguins standing on rock	[{'url': 'https://images.unsplash.com/photo-1441057206919-63d19fac2369?q=80&w=2048&auto=format&fit=crop&ixlib=rb-4.0.3&ixid=M3wxMjA3fDB8MHxwaG90by1wYWdlfHx8fGVufDB8fHx8fA%3D%3D', 'path': 'full/0af8804e017527bb77bba3939e1c40275b1f0fd8.jpg', 'checksum': '583e2e8d3227cec78b78e35a0ab041ad', 'status': 'downloaded'}]	Penguins Go Separate Ways	2015-08-31 21:41:02
two mountain goats	[{'url': 'https://images.unsplash.com/photo-1438565434616-3ef039228b15?q=80&w=6016&auto=format&fit=crop&ixlib=rb-4.0.3&ixid=M3wxMjA3fDB8MHxwaG90by1wYWdlfHx8fGVufDB8fHx8fA%3D%3D', 'path': 'full/59d83bcff14cc5fc2710adcaa2a72d5261f2cfcc.jpg', 'checksum': '2a7d71152be38851e3f5ff0a4de4ff13', 'status': 'downloaded'}]	Rams on rocky cliff	2015-08-03 01:31:38
herd of sheep in grayscale photo	[{'url': 'https://images.unsplash.com/photo-1452960962994-acf4fd70b632?q=80&w=3032&auto=format&fit=crop&ixlib=rb-4.0.3&ixid=M3wxMjA3fDB8MHxwaG90by1wYWdlfHx8fGVufDB8fHx8fA%3D%3D', 'path': 'full/4db03267ea8d63ff5ea034e12cc435caca091f7c.jpg', 'checksum': 'f7894350541a3fcbf59c12745c4d7968', 'status': 'downloaded'}]	"Questa foto l’ho scattata a Borgo Lupo, un villaggio abbandonato in Sicilia, vicino Caltagirone (provincia di Catania).

Un luogo mistico e vuoto, dove gli unici abitanti sono animali e pastori. Qui la Sicilia esprime il meglio di sè, con paesaggi attorno mozzafiato e odori che sanno di campagna, quella vera.

Altre foto qui:
https://www.davideragusa.com/portfolio/digital/borgo-lupo/"	2016-01-16 16:17:54
shallow focus photography of bees flew in mid air	[{'url': 'https://images.unsplash.com/photo-1498936178812-4b2e558d2937?q=80&w=6000&auto=format&fit=crop&ixlib=rb-4.0.3&ixid=M3wxMjA3fDB8MHxwaG90by1wYWdlfHx8fGVufDB8fHx8fA%3D%3D', 'path': 'full/ec5ee2bb18aa77160a01545d357d199dd4d16237.jpg', 'checksum': 'acf1c3080ed7777220626d2d52952f5b', 'status': 'downloaded'}]	A honey farm in Rocklin, CA is home to over 300,000 busy bees.	2017-07-01 19:11:33
a hummingbird flying near a flower	[{'url': 'https://plus.unsplash.com/premium_photo-1669725687137-75f7a1377720?q=80&w=4147&auto=format&fit=crop&ixlib=rb-4.0.3&ixid=M3wxMjA3fDB8MHxwaG90by1wYWdlfHx8fGVufDB8fHx8fA%3D%3D', 'path': 'full/d70cd0e26437c5b879a9ceaa5705e772f90e7f78.jpg', 'checksum': '00e55502b4330ff3e1160a52fd1bad8f', 'status': 'downloaded'}]	Souimanga South Africa	2022-11-29 15:21:40
a squirrel standing in grass	[{'url': 'https://plus.unsplash.com/premium_photo-1669725687338-7a68f0d58227?q=80&w=2688&auto=format&fit=crop&ixlib=rb-4.0.3&ixid=M3wxMjA3fDB8MHxwaG90by1wYWdlfHx8fGVufDB8fHx8fA%3D%3D', 'path': 'full/e9bee8133180d91cc99d85c0755d1bb790193951.jpg', 'checksum': '87f9980309e86b91a11dc63fe0eb659d', 'status': 'downloaded'}]	Wild Squirrel France	2022-11-29 15:19:39
two brown deer beside trees and mountain	[{'url': 'https://images.unsplash.com/photo-1472396961693-142e6e269027?q=80&w=3634&auto=format&fit=crop&ixlib=rb-4.0.3&ixid=M3wxMjA3fDB8MHxwaG90by1wYWdlfHx8fGVufDB8fHx8fA%3D%3D', 'path': 'full/289d5df0ed8283cbd96e06350a3941906b3b16e3.jpg', 'checksum': 'ae5abbf5b0633ba30a1f76439aba2618', 'status': 'downloaded'}]	"Two deer in front of Half Dome in Yosemite Valley during sunset.

I spent the evening in Yosemite Valley watching the sun go down on Half Dome when a couple of deer walked toward me. I took the opportunity to take this picture of them before moving out of their way so they could walk away undisturbed. It was a very beautiful experience and one of the best sunsets I've ever witnessed."	2016-08-28 15:26:50
black and brown round fruit on brown wooden round plate	[{'url': 'https://images.unsplash.com/photo-1618160702438-9b02ab6515c9?q=80&w=4896&auto=format&fit=crop&ixlib=rb-4.0.3&ixid=M3wxMjA3fDB8MHxwaG90by1wYWdlfHx8fGVufDB8fHx8fA%3D%3D', 'path': 'full/0a8a8f975f1aeb4df56171b0fa7f67d5bfe05c5c.jpg', 'checksum': '0153c79489e8334e7957f0a55f60d329', 'status': 'downloaded'}]	Download this free HD photo of fruit, blue, animals, and table by Ömürden Cengiz (@omurden)	2021-04-11 17:06:10
brown antelope and zebra on field at daytime	[{'url': 'https://images.unsplash.com/photo-1466721591366-2d5fba72006d?q=80&w=4221&auto=format&fit=crop&ixlib=rb-4.0.3&ixid=M3wxMjA3fDB8MHxwaG90by1wYWdlfHx8fGVufDB8fHx8fA%3D%3D', 'path': 'full/d579e155b616f0c270d6e0ca21e962cbf883f9aa.jpg', 'checksum': 'db361679075cd7c968463f22e5f83083', 'status': 'downloaded'}]	Antelope and zebras	2016-06-23 22:40:48
brown cattle in the middle of forest	[{'url': 'https://images.unsplash.com/photo-1465379944081-7f47de8d74ac?q=80&w=5472&auto=format&fit=crop&ixlib=rb-4.0.3&ixid=M3wxMjA3fDB8MHxwaG90by1wYWdlfHx8fGVufDB8fHx8fA%3D%3D', 'path': 'full/a6bcbaca75a780fa513107b2f33a6950868cffee.jpg', 'checksum': '04572d4bb0b5403dde4cd51c1082f457', 'status': 'downloaded'}]	Follow my Instagram @karsten.wuerth	2016-06-08 10:00:14
A living room with a couch and a table	[{'url': 'https://images.unsplash.com/photo-1721322800607-8c38375eef04?q=80&w=3011&auto=format&fit=crop&ixlib=rb-4.0.3&ixid=M3wxMjA3fDB8MHxwaG90by1wYWdlfHx8fGVufDB8fHx8fA%3D%3D', 'path': 'full/db7d942abe8d03493b00af02a09383c07447dffc.jpg', 'checksum': '95f23a9d6f526b4b4298bbb4ce51517b', 'status': 'downloaded'}]	Download this free HD photo of animals, ulitsa nekrasova, saint petersburg, and russia in Sankt-Peterburg, Russia by El S (@evucrn)	2024-07-18 19:43:15
herd of sheep running on green grass field	[{'url': 'https://images.unsplash.com/photo-1517022812141-23620dba5c23?q=80&w=2742&auto=format&fit=crop&ixlib=rb-4.0.3&ixid=M3wxMjA3fDB8MHxwaG90by1wYWdlfHx8fGVufDB8fHx8fA%3D%3D', 'path': 'full/119286db11320c220f39bb76ccb97aae6bbb79f6.jpg', 'checksum': 'd1c9634309e84cf857cd9a3f4a6be471', 'status': 'downloaded'}]	Sheeps;	2018-01-27 03:13:59
a small bird with a red head sitting on a rock	[{'url': 'https://plus.unsplash.com/premium_photo-1666930230819-46c53f9e2e3f?q=80&w=8192&auto=format&fit=crop&ixlib=rb-4.0.3&ixid=M3wxMjA3fDB8MHxwaG90by1wYWdlfHx8fGVufDB8fHx8fA%3D%3D', 'path': 'full/562d3ab79748c30d6b2181d0155c909178d06f42.jpg', 'checksum': '88665b196b5d39bbf5553e8699614e90', 'status': 'downloaded'}]	Download this HD photo of animals, nature, yellow billed cardinal, and wildlife in Ocean View, United States by Matt Bango (@mattbango)	2022-10-28 16:35:27
a white dog wearing a yellow rain coat	[{'url': 'https://plus.unsplash.com/premium_photo-1666278379770-440439b08656?q=80&w=5289&auto=format&fit=crop&ixlib=rb-4.0.3&ixid=M3wxMjA3fDB8MHxwaG90by1wYWdlfHx8fGVufDB8fHx8fA%3D%3D', 'path': 'full/21fd96a2ec04e17e3509f5536093fc61433f2d43.jpg', 'checksum': '1de5d940ed3b591e6a8baa59c3928e8c', 'status': 'downloaded'}]	Download this HD photo of animals, leaves, ottawa, and fall in Ottawa, Canada by Alesia Kazantceva (@alesiaskaz)	2022-10-21 09:14:48
brown ox on mountain	[{'url': 'https://images.unsplash.com/photo-1493962853295-0fd70327578a?q=80&w=6000&auto=format&fit=crop&ixlib=rb-4.0.3&ixid=M3wxMjA3fDB8MHxwaG90by1wYWdlfHx8fGVufDB8fHx8fA%3D%3D', 'path': 'full/baad4fa8bad92575d4040e62057757b8d93dec19.jpg', 'checksum': '6878bbaac6299a31700ef0567a42eef9', 'status': 'downloaded'}]	King of the Hillside	2017-05-05 05:44:09
orange and white tabby cat lying on brown and black floral textile	[{'url': 'https://images.unsplash.com/photo-1582562124811-c09040d0a901?q=80&w=7504&auto=format&fit=crop&ixlib=rb-4.0.3&ixid=M3wxMjA3fDB8MHxwaG90by1wYWdlfHx8fGVufDB8fHx8fA%3D%3D', 'path': 'full/3b4546a75e24b06f1bf2ac2ab5df97719df20bb5.jpg', 'checksum': '030e398624b51595c9b079dcb8cbb8ac', 'status': 'downloaded'}]	"Title: Cat with Kittens.
Date: 1844.
Institution: Rijksmuseum.
Provider: Rijksmuseum.
Providing Country: Netherlands.
Public Domain"	2020-02-24 16:36:24
